image_id,filepath,borough,road_type,sample_latitude,sample_longitude,latitude,longitude,compass_angle,captured_at,source,sky_fraction,greenery_present,greenery_density,building_height_ratio,traffic_intensity,pedestrian_activity,surface_condition,lighting,height_enc,traffic_enc,pedestrian_enc,greenery_enc,surface_enc,light_enc,green_bin,stress,calm,vitality,enclosure,safety,desolation,scene_description,vader_neg,vader_neu,vader_pos,vader_compound,roberta_neg,roberta_neu,roberta_pos,vader_negativity,negativity_index
4125924460786666,images/Brent/4125924460786666.jpg,Brent,unknown,51.57198413119531,-0.2460937998144183,51.57291,-0.24590350008255,46.0,1550935758000,Mapillary,0.6,True,high,low,none,low,fair,bright,1,0,1,3,1,3,1,2.4,8.1,5.3,3.6,6.3,4.7,"The scene shows a dirt path with two people walking away from the camera, surrounded by trees and greenery on both sides.",0.107,0.893,0.0,-0.34,0.028023580089211464,0.8237819671630859,0.14819453656673431,0.67,0.34901179004460575
787944838573824,images/Brent/787944838573824.jpg,Brent,unknown,51.5390746207206,-0.2404161051773857,51.537161144444,-0.24235952222216,278.76510620117,1519926694985,Mapillary,0.4,True,low,medium,light,medium,fair,dim,2,1,2,1,1,1,1,5.4,4.2,5.0,6.4,4.5,5.3,"A silver van is parked on the left side of a sidewalk, with a man standing beside it, and several shops line the right side of the sidewalk.",0.0,1.0,0.0,0.0,0.04510367289185524,0.8986098170280457,0.05628655105829239,0.5,0.2725518364459276
145312284169055,images/Brent/145312284169055.jpg,Brent,unknown,51.54883331284857,-0.2500156691455412,51.552223,-0.253664,269.1069,1435432537591,Mapillary,0.4,True,low,medium,light,none,fair,dim,2,1,0,1,1,1,1,5.4,4.2,1.7,6.4,3.2,8.0,"A car is driving on a street lined with trees, streetlights, and buildings, with another car approaching in the distance.",0.0,1.0,0.0,0.0,0.059259507805109024,0.8696874976158142,0.07105300575494766,0.5,0.2796297539025545
1433442444138551,images/Brent/1433442444138551.jpg,Brent,unknown,51.56066949922466,-0.2342832526224176,51.567009068323,-0.22801128987882,334.12195517352,1685007186467,Mapillary,0.6,True,low,low,light,none,fair,normal,1,1,0,1,1,2,1,4.3,4.8,2.7,3.6,4.2,7.0,A green-roofed building with advertisements for granite worktops and kitchen showrooms stands behind three parked cars on a street.,0.0,1.0,0.0,0.0,0.06535433977842331,0.8759374022483826,0.058708325028419495,0.5,0.28267716988921165
134077392043342,images/Brent/134077392043342.jpg,Brent,unknown,51.56725258576189,-0.2743214958873736,51.57335,-0.279518,13.0,1550927932000,Mapillary,0.6,True,high,low,none,none,fair,bright,1,0,0,3,1,3,1,2.4,8.1,3.7,3.6,5.7,6.0,"A dirt path runs through a wooded area with bare trees and green grass on either side, under a clear blue sky.",0.109,0.773,0.118,0.0516,0.004404957871884108,0.5668514370918274,0.4287436306476593,0.47419999999999995,0.23930247893594203
324948202477166,images/Brent/324948202477166.jpg,Brent,unknown,51.5328466659246,-0.2164660934213548,51.532139817208,-0.21744982949383,340.00939941406,1519922099543,Mapillary,0.4,True,low,medium,moderate,low,fair,dim,2,2,1,1,1,1,1,6.6,3.5,3.3,6.4,3.3,6.7,"A street with buildings and shops on the left and a tree-lined fence on the right, with people waiting at a traffic light.",0.0,1.0,0.0,0.0,0.15276749432086945,0.8089893460273743,0.038243189454078674,0.5,0.3263837471604347
224539459078465,images/Brent/224539459078465.jpg,Brent,unknown,51.55002240846948,-0.3116747906223167,51.549605,-0.31255410000114,97.0,1565172351484,Mapillary,0.6,True,high,low,light,none,good,normal,1,1,0,3,2,2,1,3.1,7.8,3.3,3.6,5.3,6.0,"The scene shows a road with a silver car and a white van driving on it, lined with trees on both sides.",0.0,1.0,0.0,0.0,0.039469391107559204,0.8860778212547302,0.0744527280330658,0.5,0.2697346955537796
150710133594122,images/Brent/150710133594122.jpg,Brent,unknown,51.53669654669463,-0.2939953634557485,51.538187815,-0.29435542416667,90.81,1435423421000,Mapillary,0.6,True,high,low,none,none,good,bright,1,0,0,3,2,3,1,1.9,8.5,4.3,3.6,6.8,5.0,"A paved path runs alongside a body of water, lined with grass and trees on one side and a dense hedge on the other.",0.0,1.0,0.0,0.0,0.02224760688841343,0.9092229008674622,0.06852950900793076,0.5,0.2611238034442067
205808667844584,images/Brent/205808667844584.jpg,Brent,unknown,51.53350344097718,-0.2644280652630345,51.534860283056,-0.26257837166668,112.538456,1523796095000,Mapillary,0.4,True,medium,medium,none,none,good,dim,2,0,0,2,2,1,1,3.4,6.5,2.3,6.4,4.8,7.0,A canal with a gray building on the left and colorful houseboats on the right.,0.0,1.0,0.0,0.0,0.012450644746422768,0.7813342809677124,0.20621515810489655,0.5,0.2562253223732114
763411565967827,images/Brent/763411565967827.jpg,Brent,unknown,51.55906954621482,-0.3298404440380972,51.5599717,-0.3288614,83.0,1715793630000,Mapillary,0.6,True,high,low,light,none,good,bright,1,1,0,3,2,3,1,3.1,7.8,4.3,3.6,6.3,5.0,"A silver car is parked on the side of a road next to a tall tree and a signpost with a blue and white sign indicating a left turn, while other cars drive on the road in the background.",0.0,1.0,0.0,0.0,0.06076478585600853,0.8794125318527222,0.05982263386249542,0.5,0.28038239292800426
517282855962867,images/Brent/517282855962867.jpg,Brent,unknown,51.545859840985706,-0.2891375773825874,51.539083337222,-0.2918902225,232.66296,1523990850000,Mapillary,0.6,True,medium,low,none,none,fair,normal,1,0,0,2,1,2,1,2.8,6.8,2.7,3.6,4.7,7.0,The scene shows a canal with trees and bushes on both sides and houses in the background under a cloudy sky.,0.0,1.0,0.0,0.0,0.04991200566291809,0.8805794715881348,0.06950844824314117,0.5,0.27495600283145905
1198566315722312,images/Brent/1198566315722312.jpg,Brent,unknown,51.54725185881549,-0.2387080123072064,51.5456113,-0.23087150639098,270.00000606854,1768671652058,Mapillary,0.4,True,none,medium,moderate,none,good,dim,2,2,0,0,2,1,1,6.4,2.5,2.3,6.4,3.8,7.0,The image shows a nighttime city street scene with a car dashboard in the foreground and several buildings and cars in the background.,0.0,1.0,0.0,0.0,0.01841386780142784,0.9084405303001404,0.07314559072256088,0.5,0.2592069339007139
2835835103346394,images/Brent/2835835103346394.jpg,Brent,unknown,51.575029387940624,-0.2677848096352898,51.57423,-0.2676745,165.0,1550930015000,Mapillary,0.4,True,low,medium,light,none,fair,bright,2,1,0,1,1,3,1,5.4,4.2,3.7,6.4,5.2,6.0,A silver SUV is parked on a residential street lined with brick houses and a leafless tree.,0.0,1.0,0.0,0.0,0.024380890652537346,0.8937329649925232,0.08188609033823013,0.5,0.2621904453262687
306615547567759,images/Brent/306615547567759.jpg,Brent,unknown,51.54085123018921,-0.2035774707174764,51.538527054538,-0.20756485870956,153.85592651367,1406396157000,Mapillary,0.6,True,medium,low,light,none,fair,bright,1,1,0,2,1,3,1,3.9,6.1,3.7,3.6,5.2,6.0,A sidewalk runs along a street with trees and buildings on both sides.,0.0,1.0,0.0,0.0,0.02707076072692871,0.9105672240257263,0.06236192584037781,0.5,0.26353538036346436
1164389450650122,images/Brent/1164389450650122.jpg,Brent,unknown,51.534288817733774,-0.2647262702200511,51.535588586667,-0.26521146277776,108.149416,1523795927000,Mapillary,0.6,True,medium,low,none,none,fair,dim,1,0,0,2,1,1,1,2.8,6.8,1.7,3.6,3.7,8.0,"A canal with houseboats moored along its edge, lined with trees, bushes and buildings on both sides under a grey sky.",0.0,0.938,0.062,0.0516,0.12666180729866028,0.8283117413520813,0.04502641037106514,0.47419999999999995,0.3004309036493301
973330760950148,images/Brent/973330760950148.jpg,Brent,unknown,51.55189096972514,-0.2854429052330534,51.5520953,-0.2843367,279.0,1715793008000,Mapillary,0.4,True,medium,medium,none,low,fair,bright,2,0,1,2,1,3,1,3.9,6.2,5.3,6.4,6.3,4.7,"A row of multi-story houses with bay windows and balconies lines the street, with a Pepsi advertisement banner visible.",0.0,1.0,0.0,0.0,0.028427451848983765,0.8450433611869812,0.12652908265590668,0.5,0.2642137259244919
1125188031291499,images/Barnet/1125188031291499.jpg,Barnet,unknown,51.65380889622387,-0.1873523098698759,51.652716390292,-0.18576268623963,212.47904968262,1494169097000,Mapillary,0.6,True,medium,low,moderate,low,fair,bright,1,2,1,2,1,3,1,5.1,5.5,5.3,3.6,5.3,4.7,"A curved road with multiple parked cars on both sides, a person standing on the road, and trees lining the roadside under a blue sky with clouds.",0.0,1.0,0.0,0.0,0.048820674419403076,0.860927402973175,0.09025195240974426,0.5,0.27441033720970154
1238951018143410,images/Barnet/1238951018143410.jpg,Barnet,unknown,51.6349452216238,-0.2474036474261784,51.636660252632,-0.25441693533835,159.6564292739,1768654094563,Mapillary,0.6,True,medium,low,moderate,none,good,normal,1,2,0,2,2,2,1,4.6,5.8,3.3,3.6,4.8,6.0,A road with a bus and cars traveling on it,0.0,1.0,0.0,0.0,0.12695340812206268,0.8294855952262878,0.04356091469526291,0.5,0.31347670406103134
493511408468438,images/Barnet/493511408468438.jpg,Barnet,unknown,51.61843662353459,-0.1620435833769061,51.6190546,-0.1601409,357.40838381492,1462463031719,Mapillary,0.6,True,medium,low,moderate,none,fair,normal,1,2,0,2,1,2,1,5.1,5.5,2.7,3.6,3.7,7.0,A line of cars is driving on a road with trees and houses on either side.,0.0,1.0,0.0,0.0,0.06950125098228455,0.8643649220466614,0.06613385677337646,0.5,0.2847506254911423
1666561770385943,images/Barnet/1666561770385943.jpg,Barnet,unknown,51.59134952234921,-0.2253434222433909,51.5943745,-0.223555,344.46375270082,1658678581999,Mapillary,0.4,True,medium,medium,light,low,good,bright,2,1,1,2,2,3,1,4.6,5.9,6.0,6.4,7.0,3.7,"The scene shows a street with cars parked along both sides, several residential buildings, a few trees, and a blue sky with scattered clouds.",0.0,1.0,0.0,0.0,0.01215221919119358,0.8286769986152649,0.1591707319021225,0.5,0.2560761095955968
267083238450255,images/Barnet/267083238450255.jpg,Barnet,unknown,51.63080438694965,-0.1312436048815884,51.6332372,-0.13048,293.46505613162,1463389787940,Mapillary,0.4,True,none,medium,moderate,none,fair,bright,2,2,0,0,1,3,1,6.9,2.2,3.7,6.4,4.7,6.0,"The image shows a busy street with multiple-lane road, lined with brick buildings and shops on the right-hand side, while the left side has more buildings and less commercial activity, with a mix of cars and a large white van traveling in the same direction as the camera.",0.0,1.0,0.0,0.0,0.05361909419298172,0.808404803276062,0.13797609508037567,0.5,0.27680954709649086
916606255578800,images/Barnet/916606255578800.jpg,Barnet,unknown,51.60270161899259,-0.2098567789569488,51.608673501808,-0.21537107415517,275.27978515625,1547999181533,Mapillary,0.6,True,high,low,none,none,poor,bright,1,0,0,3,0,3,1,2.9,7.8,3.0,3.6,4.5,7.0,A dirt path runs through a wooded area with trees on both sides and a fence on the right.,0.138,0.862,0.0,-0.34,0.036907490342855453,0.9151328206062317,0.04795967787504196,0.67,0.35345374517142775
841738456690529,images/Barnet/841738456690529.jpg,Barnet,unknown,51.627096068813664,-0.1721229385405714,51.6261113,-0.172955,311.56836614932,1462463159086,Mapillary,0.6,True,low,low,moderate,none,fair,normal,1,2,0,1,1,2,1,5.4,4.1,2.7,3.6,3.7,7.0,"A suburban street with parked and moving cars on both sides, lined with trees and houses under a cloudy sky.",0.0,1.0,0.0,0.0,0.05576677992939949,0.868588387966156,0.07564475387334824,0.5,0.27788338996469975
183996324021113,images/Barnet/183996324021113.jpg,Barnet,unknown,51.57859138305264,-0.1714970015656339,51.5719352,-0.1785518,303.55839667869,1658678531899,Mapillary,0.4,True,medium,medium,light,none,good,normal,2,1,0,2,2,2,1,4.6,5.9,3.3,6.4,5.3,6.0,"A four-lane road with a sidewalk on each side, lined with trees and several buildings, including a tall brown building with white framed windows on the left and a white building with scaffolding on the right, with cars parked along the right side of the road.",0.0,1.0,0.0,0.0,0.03239322826266289,0.9098872542381287,0.057719480246305466,0.5,0.26619661413133144
623020411950264,images/Barnet/623020411950264.jpg,Barnet,unknown,51.66185061126886,-0.2086876107121512,51.662709192495,-0.20775633752532,152.57684326172,1514038859081,Mapillary,0.6,True,high,low,light,none,fair,dim,1,1,0,3,1,1,1,3.6,7.5,1.7,3.6,3.2,8.0,A car drives on a road lined with bare trees on a gloomy day.,0.138,0.862,0.0,-0.1531,0.3477017879486084,0.5966367125511169,0.05566149577498436,0.57655,0.4621258939743042
181056697207979,images/Barnet/181056697207979.jpg,Barnet,unknown,51.63547141435307,-0.2282918755298661,51.638643,-0.2287957,94.854193737217,1464371612193,Mapillary,0.6,True,high,low,none,none,fair,normal,1,0,0,3,1,2,1,2.4,8.1,2.7,3.6,4.7,7.0,A curved road with a white line down the center and trees on both sides.,0.0,1.0,0.0,0.0,0.039315562695264816,0.8997542858123779,0.06093016266822815,0.5,0.2696577813476324
144911347597850,images/Barnet/144911347597850.jpg,Barnet,unknown,51.58270070569839,-0.1981619864924288,51.5817914,-0.1989328,167.71900035894,1460367558467,Mapillary,0.4,True,none,medium,moderate,low,fair,normal,2,2,1,0,1,2,1,6.9,2.2,4.3,6.4,4.3,5.7,"The image shows a street with a row of shops on the left and right, several cars driving on the road, and a sidewalk with a few pedestrians.",0.0,1.0,0.0,0.0,0.03253646567463875,0.9162169098854065,0.05124662071466446,0.5,0.2662682328373194
142136711229026,images/Barnet/142136711229026.jpg,Barnet,unknown,51.61852198501425,-0.2776517454857828,51.622397211864,-0.28157612881353,108.55087280273,1503072904000,Mapillary,0.6,True,medium,low,moderate,none,fair,normal,1,2,0,2,1,2,1,5.1,5.5,2.7,3.6,3.7,7.0,"The image shows a road with cars driving on it, lined with trees and streetlights on either side, under a cloudy blue sky.",0.0,1.0,0.0,0.0,0.011784174479544163,0.7977679371833801,0.19044789671897888,0.5,0.2558920872397721
864982592836549,images/Barnet/864982592836549.jpg,Barnet,unknown,51.56590336841498,-0.208152653687558,51.5665038305,-0.2061924475,161.64998589648,1768655096127,Mapillary,0.6,True,none,low,light,none,good,normal,1,1,0,0,2,2,1,4.1,3.8,3.3,3.6,5.3,6.0,"A two-lane road with a car in the adjacent lane on the left and a guardrail on the right, lined with parked cars, and rows of houses on both sides under a cloudy sky.",0.0,1.0,0.0,0.0,0.08579043298959732,0.871775209903717,0.04243430867791176,0.5,0.29289521649479866
194137849211248,images/Barnet/194137849211248.jpg,Barnet,unknown,51.56869245037735,-0.2241749702374268,51.567358,-0.224686,238.60127621889,1469109470090,Mapillary,0.6,True,medium,low,none,none,fair,normal,1,0,0,2,1,2,1,2.8,6.8,2.7,3.6,4.7,7.0,The image shows a set of train tracks with trees and bushes in the background under a cloudy sky.,0.0,1.0,0.0,0.0,0.03856366127729416,0.9017037749290466,0.059732586145401,0.5,0.2692818306386471
468028484429967,images/Barnet/468028484429967.jpg,Barnet,unknown,51.61248969236585,-0.1587656397581556,51.6123132,-0.1579364,312.73346460344,1462462903141,Mapillary,0.4,True,none,medium,moderate,low,fair,normal,2,2,1,0,1,2,1,6.9,2.2,4.3,6.4,4.3,5.7,A blue car and several other vehicles are driving on a road with buildings and shops on the left side.,0.0,1.0,0.0,0.0,0.08659394830465317,0.8572977781295776,0.056108277291059494,0.5,0.2932969741523266
583288790204346,images/Barnet/583288790204346.jpg,Barnet,unknown,51.61369658896104,-0.1791526921509834,51.6123311,-0.1800549,334.63111610929,1659012407400,Mapillary,0.2,True,low,high,light,low,good,normal,3,1,1,1,2,2,1,6.0,3.9,5.0,9.2,6.0,4.7,"A couple walks on the sidewalk next to a large gray building on the left, while a truck drives down the street to the right, with other buildings and a cloudy sky in the background.",0.0,1.0,0.0,0.0,0.022546963766217232,0.9099311828613281,0.06752189993858337,0.5,0.2612734818831086
891827000158705,images/Barnet/891827000158705.jpg,Barnet,unknown,51.59929111096829,-0.2083266923943758,51.594377091566,-0.21543266987952,300.28608826798,1768688879597,Mapillary,0.6,True,low,low,heavy,none,good,bright,1,3,0,1,2,3,1,6.1,3.8,4.3,3.6,5.3,5.0,A line of cars with their red brake lights on are driving on a multi-lane road at night with streetlights illuminating the scene.,0.0,1.0,0.0,0.0,0.05285792797803879,0.850552499294281,0.0965895801782608,0.5,0.2764289639890194
488955659204158,images/Barnet/488955659204158.jpg,Barnet,unknown,51.613624021912685,-0.1429336317958274,51.6161581,-0.1426654,60.976796427022,1463387718775,Mapillary,0.4,True,low,medium,moderate,low,fair,normal,2,2,1,1,1,2,1,6.6,3.5,4.3,6.4,4.3,5.7,"The image shows a street scene with a row of buildings on the left, a sidewalk with trees and people, and a road with multiple vehicles traveling in the same direction.",0.0,1.0,0.0,0.0,0.04202054440975189,0.905838668346405,0.052140798419713974,0.5,0.27101027220487595
835706943992711,images/Barnet/835706943992711.jpg,Barnet,unknown,51.64953349570578,-0.2160071197380761,51.647586382164,-0.21756893587178,320.03686523438,1503068344000,Mapillary,0.6,True,medium,low,light,none,fair,dim,1,1,0,2,1,1,1,3.9,6.1,1.7,3.6,3.2,8.0,"A suburban street with parked cars on both sides, trees and hedges lining the road, and houses visible on the left side.",0.0,1.0,0.0,0.0,0.08389110863208771,0.8652599453926086,0.050848934799432755,0.5,0.29194555431604385
263836533326760,images/Barnet/263836533326760.jpg,Barnet,unknown,51.57227171699302,-0.2192004007119588,51.5740962,-0.2209488,212.81112074852,1708774316601,Mapillary,0.4,True,low,medium,moderate,none,fair,dim,2,2,0,1,1,1,1,6.6,3.5,1.7,6.4,2.7,8.0,"A silver SUV is driving on a wet road next to a sidewalk with a graffiti-covered wall and a brown building, with a busy highway and a large brick building in the background.",0.0,1.0,0.0,0.0,0.11824271082878113,0.8246676921844482,0.057089537382125854,0.5,0.30912135541439056
189169766371003,images/Lambeth/189169766371003.jpg,Lambeth,unknown,51.44462328217224,-0.111955563263096,51.445105999009,-0.11173022993057,342.12149047852,1496085243000,Mapillary,0.6,True,high,low,moderate,none,fair,dim,1,2,0,3,1,1,1,4.8,6.8,1.7,3.6,2.7,8.0,A two-lane road with cars driving on it and trees on both sides.,0.0,1.0,0.0,0.0,0.1581496000289917,0.7913063168525696,0.05054406449198723,0.5,0.32907480001449585
130473039125665,images/Lambeth/130473039125665.jpg,Lambeth,unknown,51.46394813824903,-0.1109829780284231,51.464800109925,-0.11033535432227,159.31619262695,1500967639303,Mapillary,0.4,True,medium,medium,moderate,low,fair,normal,2,2,1,2,1,2,1,6.2,4.9,4.3,6.4,4.3,5.7,"A red double-decker bus and several cars are driving on a road with white markings, while a cyclist rides on the sidewalk and trees line the road.",0.0,1.0,0.0,0.0,0.17241597175598145,0.7522112131118774,0.07537288963794708,0.5,0.3362079858779907
473213553952207,images/Lambeth/473213553952207.jpg,Lambeth,unknown,51.43375165686334,-0.1095332182554027,51.4376295,-0.10556153409084,352.46243286133,1496084922000,Mapillary,0.4,True,medium,medium,moderate,none,fair,normal,2,2,0,2,1,2,1,6.2,4.9,2.7,6.4,3.7,7.0,A red double-decker bus drives on a road with cars and a bus stop on the right side.,0.136,0.864,0.0,-0.296,0.1295352727174759,0.8145912885665894,0.055873408913612366,0.648,0.38876763635873796
291933165822928,images/Lambeth/291933165822928.jpg,Lambeth,unknown,51.45551855237871,-0.1128765653108255,51.454632337958,-0.11349144598614,352.92318725586,1496085424000,Mapillary,0.4,True,low,medium,moderate,low,fair,normal,2,2,1,1,1,2,1,6.6,3.5,4.3,6.4,4.3,5.7,"A street with buildings on both sides, a sidewalk on the left, and several cars driving on the road.",0.0,1.0,0.0,0.0,0.08277156203985214,0.8665423393249512,0.05068610981106758,0.5,0.29138578101992607
370871167572963,images/Lambeth/370871167572963.jpg,Lambeth,unknown,51.4260335273944,-0.1034816565632125,51.429447136508,-0.10118805608465,338.91729736328,1496084547000,Mapillary,0.4,True,low,medium,light,low,good,dim,2,1,1,1,2,1,1,4.9,4.5,4.0,6.4,5.0,5.7,A blue car is parked on the side of a street lined with buildings and a sidewalk with people.,0.0,1.0,0.0,0.0,0.07521363347768784,0.8735587000846863,0.051227688789367676,0.5,0.2876068167388439
1870196050138034,images/Lambeth/1870196050138034.jpg,Lambeth,unknown,51.50543961043837,-0.1169939302533675,51.5046733,-0.1165716,202.101,1726757268000,Mapillary,0.2,True,low,high,moderate,low,good,bright,3,2,1,1,2,3,1,7.2,3.3,6.0,9.2,6.5,3.7,"A road with a yellow line down the middle stretches between two large white buildings, with a blue double-decker bus driving away from the camera and a red double-decker bus driving towards the camera, with a construction site and a London Eye visible in the background.",0.0,1.0,0.0,0.0,0.08769040554761887,0.859086811542511,0.05322275310754776,0.5,0.29384520277380943
266663011871511,images/Lambeth/266663011871511.jpg,Lambeth,unknown,51.47849488495827,-0.1265419172659484,51.478319,-0.12664,358.1643,1430465527864,Mapillary,0.4,True,medium,medium,light,low,fair,normal,2,1,1,2,1,2,1,5.1,5.5,4.3,6.4,4.8,5.7,"A residential street with parked cars on both sides, lined with trees and brick buildings, including a large red-brick building with white-framed windows on the left.",0.0,1.0,0.0,0.0,0.033292315900325775,0.9000322222709656,0.06667540222406387,0.5,0.2666461579501629
292814099163999,images/Lambeth/292814099163999.jpg,Lambeth,unknown,51.44184959433301,-0.123519321680344,51.442073219235,-0.12430332885208,60.053352355957,1494686508000,Mapillary,0.2,True,low,high,light,none,fair,normal,3,1,0,1,1,2,1,6.5,3.6,2.7,9.2,4.2,7.0,"The image shows a street with a row of shops and a multi-story brick building behind them, a motorcycle parked on the sidewalk, and a car driving on the road in front of a median strip with vegetation.",0.0,1.0,0.0,0.0,0.13871601223945618,0.8245928883552551,0.036691177636384964,0.5,0.3193580061197281
1381090769634103,images/Lambeth/1381090769634103.jpg,Lambeth,unknown,51.44751920694772,-0.1298376374009179,51.447312283333,-0.12999387,294.07750566535,1751313405433,Mapillary,0.4,True,medium,medium,light,none,good,normal,2,1,0,2,2,2,1,4.6,5.9,3.3,6.4,5.3,6.0,The image shows a road with a 20mph speed limit in a residential area lined with trees and multi-story brick buildings.,0.0,1.0,0.0,0.0,0.06152423843741417,0.8866520524024963,0.05182373523712158,0.5,0.2807621192187071
4200880786598960,images/Lambeth/4200880786598960.jpg,Lambeth,unknown,51.46275304098273,-0.140615763264633,51.462253857719,-0.14025581029262,244.02644348145,1494783589000,Mapillary,0.6,True,high,low,none,medium,fair,normal,1,0,2,3,1,2,1,2.4,8.1,6.0,3.6,6.0,4.3,"The scene shows a park with people sitting on the grass, trees, a statue on a pedestal, and trash cans and bins scattered around.",0.0,1.0,0.0,0.0,0.4477287232875824,0.5134468674659729,0.03882434964179993,0.5,0.4738643616437912
2790669987852704,images/Lambeth/2790669987852704.jpg,Lambeth,unknown,51.48822180658364,-0.109961255720033,51.488788,-0.110803,104.23539066315,1467394845457,Mapillary,0.4,True,none,medium,light,low,fair,dim,2,1,1,0,1,1,1,5.7,2.9,3.3,6.4,3.8,6.7,A white van and a white truck are parked on the side of a street lined with brick buildings.,0.0,1.0,0.0,0.0,0.16899734735488892,0.8015525341033936,0.029450152069330215,0.5,0.33449867367744446
930631417768599,images/Lambeth/930631417768599.jpg,Lambeth,unknown,51.41868652107824,-0.138835389920201,51.419657,-0.139712,148.304,1460561536610,Mapillary,0.4,True,low,medium,none,none,fair,dim,2,0,0,1,1,1,1,4.2,4.9,1.7,6.4,3.7,8.0,The image shows a suburban street scene with rows of brick houses and a cloudy sky.,0.0,1.0,0.0,0.0,0.017457641661167145,0.8857636451721191,0.0967787653207779,0.5,0.2587288208305836
127547656035419,images/Lambeth/127547656035419.jpg,Lambeth,unknown,51.45592996897155,-0.1407945801813652,51.457880453,-0.14264459,120.09820556641,1527513135834,Mapillary,0.4,True,medium,medium,moderate,low,fair,bright,2,2,1,2,1,3,1,6.2,4.9,5.3,6.4,5.3,4.7,"A couple walks on a sidewalk next to a tree and trash cans, with cars parked along the street and buildings in the background.",0.0,1.0,0.0,0.0,0.15074168145656586,0.801476001739502,0.04778227210044861,0.5,0.32537084072828293
1270901163622137,images/Lambeth/1270901163622137.jpg,Lambeth,unknown,51.43587257592545,-0.1327101738335335,51.4395567,-0.1310256,106.121,1687516633200,Mapillary,0.6,True,medium,low,moderate,none,good,bright,1,2,0,2,2,3,1,4.6,5.8,4.3,3.6,5.8,5.0,"A suburban street with brick houses, parked cars, and a blue sky with clouds.",0.0,1.0,0.0,0.0,0.04561641439795494,0.8107632398605347,0.1436203122138977,0.5,0.27280820719897747
1928184657766332,images/Lambeth/1928184657766332.jpg,Lambeth,unknown,51.4540374847152,-0.1397110718889828,51.451929,-0.1420266,0.0,1751313561613,Mapillary,0.4,True,low,medium,none,none,good,dim,2,0,0,1,2,1,1,3.7,5.2,2.3,6.4,4.8,7.0,"A multi-story brick building with white trim and a red postbox in front, situated on the side of a road with a tree beside it.",0.0,1.0,0.0,0.0,0.014142615720629692,0.9010133147239685,0.08484408259391785,0.5,0.25707130786031485
899787211057332,images/Lambeth/899787211057332.jpg,Lambeth,unknown,51.4682497244857,-0.1260311240798438,51.4679149,-0.1251903,184.83027161422,1659012446300,Mapillary,0.4,True,low,medium,moderate,low,fair,normal,2,2,1,1,1,2,1,6.6,3.5,4.3,6.4,4.3,5.7,"A street scene showing a road with a sidewalk on the left, lined with buildings, trees, and people, and vehicles parked along the right side.",0.0,1.0,0.0,0.0,0.06356924772262573,0.8903728127479553,0.04605800658464432,0.5,0.28178462386131287
378144720199753,images/Lambeth/378144720199753.jpg,Lambeth,unknown,51.45233982998334,-0.1046369754377081,51.453052277664,-0.10458110450794,125.75662231445,1569158753392,Mapillary,0.4,True,medium,medium,moderate,low,fair,dim,2,2,1,2,1,1,1,6.2,4.9,3.3,6.4,3.3,6.7,"A red double-decker bus is driving on a wet road with white markings, lined with parked cars and shops on the left side, and trees with autumn foliage on the right side.",0.0,1.0,0.0,0.0,0.19425947964191437,0.732395589351654,0.07334490120410919,0.5,0.3471297398209572
