image_id,filepath,borough,road_type,sample_latitude,sample_longitude,latitude,longitude,compass_angle,captured_at,source,sky_fraction,greenery_present,greenery_density,building_height_ratio,traffic_intensity,pedestrian_activity,surface_condition,lighting,height_enc,traffic_enc,pedestrian_enc,greenery_enc,surface_enc,light_enc,green_bin,stress,calm,vitality,enclosure,safety,desolation,scene_description,vader_neg,vader_neu,vader_pos,vader_compound,roberta_neg,roberta_neu,roberta_pos,vader_negativity,negativity_index
1043642439856496,images/Kensington_and_Chelsea/1043642439856496.jpg,Kensington and Chelsea,unknown,51.48977362520446,-0.1970597966376168,51.491002299972,-0.1972661,55.145182042328,1653220371000,Mapillary,0.4,True,medium,medium,moderate,none,good,bright,2,2,0,2,2,3,1,5.7,5.2,4.3,6.4,5.8,5.0,"A four-lane road with cars parked along the sides, brick buildings with multiple stories, trees, and a clear blue sky.",0.0,0.867,0.133,0.3818,0.012943078763782978,0.7065030336380005,0.2805538773536682,0.30910000000000004,0.1610215393818915
1356978124679356,images/Kensington_and_Chelsea/1356978124679356.jpg,Kensington and Chelsea,unknown,51.52313059838191,-0.2116234149819004,51.524038491819,-0.210872422904,36.975512301491,1517481089136,Mapillary,0.6,True,none,low,none,none,fair,bright,1,0,0,0,1,3,1,3.4,4.1,3.7,3.6,5.7,6.0,"A brick building with yellow accents and multiple windows is situated behind a brick wall, with train tracks and a clear blue sky visible in the foreground.",0.0,0.898,0.102,0.3818,0.006902563385665417,0.7588165998458862,0.23428082466125488,0.30910000000000004,0.15800128169283273
3820015124787263,images/Westminster/3820015124787263.jpg,Westminster,unknown,51.52966297513522,-0.1857195838986381,51.529716,-0.186444,84.48462,1447594841689,Mapillary,0.4,True,medium,medium,moderate,none,fair,normal,2,2,0,2,1,2,1,6.2,4.9,2.7,6.4,3.7,7.0,"A city street with cars parked along both sides, trees lining the road, and buildings of varying heights in the background.",0.0,1.0,0.0,0.0,0.037958789616823196,0.8987691402435303,0.06327202171087265,0.5,0.2689793948084116
1524410988013504,images/Westminster/1524410988013504.jpg,Westminster,unknown,51.50233828713333,-0.1392886596579984,51.501873199972,-0.13832569997222,74.518602263933,1663015350000,Mapillary,0.6,True,high,low,none,medium,good,dim,1,0,2,3,2,1,1,1.9,8.5,5.7,3.6,6.2,4.3,"A paved path runs alongside a body of water, separated by a black metal fence, with people walking on the path and in a grassy area to the left.",0.0,1.0,0.0,0.0,0.0387779138982296,0.926791250705719,0.034430842846632004,0.5,0.2693889569491148
1009675633722172,images/Westminster/1009675633722172.jpg,Westminster,unknown,51.52178509638435,-0.153314902851397,51.522745098039,-0.1547968,118.70131337643,1686753154822,Mapillary,0.4,True,medium,medium,moderate,none,good,bright,2,2,0,2,2,3,1,5.7,5.2,4.3,6.4,5.8,5.0,"A blue bus is parked on the left side of a multi-lane road, with other vehicles traveling in the opposite direction on the right side of the road.",0.0,1.0,0.0,0.0,0.25693637132644653,0.7095242738723755,0.03353935480117798,0.5,0.37846818566322327
3831659007059307,images/Westminster/3831659007059307.jpg,Westminster,unknown,51.50829377612683,-0.1503673441652523,51.507797150971,-0.15094146165049,168.72131347656,1647108006361,Mapillary,0.2,True,low,high,moderate,none,fair,dim,3,2,0,1,1,1,1,7.7,2.9,1.7,9.2,2.7,8.0,A city street with multiple buildings and lit-up cars driving on the road.,0.0,1.0,0.0,0.0,0.15893402695655823,0.7817688584327698,0.05929722264409065,0.5,0.3294670134782791
1831142037233802,images/Westminster/1831142037233802.jpg,Westminster,unknown,51.502328980297705,-0.1335892185141571,51.5021117,-0.13379379997222,97.814204117899,1663015761000,Mapillary,0.6,True,high,low,none,low,fair,normal,1,0,1,3,1,2,1,2.4,8.1,4.3,3.6,5.3,5.7,A man sits on a wooden bench on a tree-lined path in a park with people in the background.,0.0,1.0,0.0,0.0,0.06145797297358513,0.8834421038627625,0.05509987846016884,0.5,0.28072898648679256
135650942401485,images/Westminster/135650942401485.jpg,Westminster,unknown,51.52628809222461,-0.1765650600141172,51.526735699999,-0.17586789999738,0.0,1654014015354,Mapillary,0.4,True,high,medium,light,low,fair,normal,2,1,1,3,1,2,1,4.7,6.9,4.3,6.4,4.8,5.7,"A sidewalk with a tree and a red car parked on the right, a brick wall with greenery on the left, and people walking in the distance.",0.0,1.0,0.0,0.0,0.009679019451141357,0.7896878123283386,0.20063316822052002,0.5,0.2548395097255707
1049201446437616,images/Westminster/1049201446437616.jpg,Westminster,unknown,51.531508222105096,-0.1663751653806423,51.531515292391,-0.16693434693603,17.097825558323,1689941582001,Mapillary,0.4,True,medium,medium,light,low,good,normal,2,1,1,2,2,2,1,4.6,5.9,5.0,6.4,6.0,4.7,"The scene shows a road with a person on a mobility scooter, a multi-story brick building with white trim, trees, and cars.",0.0,1.0,0.0,0.0,0.02538902312517166,0.9068760275840759,0.06773490458726883,0.5,0.26269451156258583
1429569175503137,images/Westminster/1429569175503137.jpg,Westminster,unknown,51.52371229392957,-0.184515071460489,51.523429020101,-0.18449903567839,121.02575935332,1768685319792,Mapillary,0.4,True,low,medium,moderate,none,good,normal,2,2,0,1,2,2,1,6.1,3.9,3.3,6.4,4.8,6.0,"A car is driving on a road at night with buildings, streetlights, and other vehicles visible.",0.0,1.0,0.0,0.0,0.15656888484954834,0.8014919757843018,0.04193909838795662,0.5,0.32828444242477417
322396782610418,images/Westminster/322396782610418.jpg,Westminster,unknown,51.48988585945199,-0.127150492815973,51.490805555556,-0.12791944444439,-1.0,1308318067000,Mapillary,0.2,True,none,high,none,low,excellent,bright,3,0,1,0,3,3,1,4.7,3.6,6.7,9.2,8.7,2.7,"The image shows a large room with white walls and a high ceiling, featuring several people looking at artwork and a display case.",0.0,1.0,0.0,0.0,0.005213925149291754,0.8254181146621704,0.1693679839372635,0.5,0.2526069625746459
246423398074649,images/Westminster/246423398074649.jpg,Westminster,unknown,51.49527606862956,-0.1400165104701647,51.496239,-0.13960020000274,11.697910010815,1685018846615,Mapillary,0.2,True,medium,high,light,low,good,normal,3,1,1,2,2,2,1,5.7,5.3,5.0,9.2,6.0,4.7,"A cityscape with modern glass buildings and older structures, featuring a mix of greenery on rooftops and in the distance, under a cloudy sky.",0.0,1.0,0.0,0.0,0.0034094706643372774,0.4647703170776367,0.5318201780319214,0.5,0.25170473533216864
1002437091774427,images/Westminster/1002437091774427.jpg,Westminster,unknown,51.52184778860053,-0.187903509151586,51.522562288905,-0.18734938153388,116.90923622783,1751721150108,Mapillary,0.6,True,medium,low,light,low,fair,dim,1,1,1,2,1,1,1,3.9,6.1,3.3,3.6,3.8,6.7,"The image shows a road with a white building and a tree on the left side, and a stone wall with trees on the right side.",0.0,1.0,0.0,0.0,0.029409972950816154,0.9289610981941223,0.041628871113061905,0.5,0.2647049864754081
596021808021502,images/Westminster/596021808021502.jpg,Westminster,unknown,51.53284340778464,-0.1527895089811218,51.53329295111,-0.15275507234051,278.19689941406,1527443950112,Mapillary,0.6,True,high,low,none,low,good,dim,1,0,1,3,2,1,1,1.9,8.5,4.0,3.6,5.5,5.7,A paved path runs through a park with trees and grass on both sides and people riding bicycles in the distance.,0.0,1.0,0.0,0.0,0.012943914160132408,0.8584524989128113,0.12860362231731415,0.5,0.2564719570800662
1677106597000474,images/Westminster/1677106597000474.jpg,Westminster,unknown,51.52668845338957,-0.1963337861733703,51.527596792,-0.196687228,112.64480691001,1768685105097,Mapillary,0.4,True,none,medium,moderate,none,fair,bright,2,2,0,0,1,3,1,6.9,2.2,3.7,6.4,4.7,6.0,"A city street at night with a red double-decker bus stopped at a traffic light, several cars in front of it and buildings lining both sides of the road.",0.071,0.929,0.0,-0.2263,0.0828850194811821,0.8576333522796631,0.05948159843683243,0.61315,0.34801750974059104
1019030795471141,images/Westminster/1019030795471141.jpg,Westminster,unknown,51.51553349948435,-0.1400458514449348,51.5152586,-0.1404004,88.140647579727,1658589309700,Mapillary,0.2,True,none,high,moderate,medium,good,normal,3,2,2,0,2,2,1,7.5,1.9,6.7,9.2,6.2,3.3,"A street scene showing people walking on the sidewalk, vehicles driving on the road, and buildings with storefronts and Union Jack flags hanging above the street.",0.0,1.0,0.0,0.0,0.05690910667181015,0.8725060224533081,0.07058489322662354,0.5,0.2784545533359051
1001834734347600,images/Westminster/1001834734347600.jpg,Westminster,unknown,51.53261537655429,-0.1657583262217343,51.532257640808,-0.16651617905724,20.395843049018,1689941582835,Mapillary,0.4,True,medium,medium,light,none,fair,normal,2,1,0,2,1,2,1,5.1,5.5,2.7,6.4,4.2,7.0,"A street with a large building on the left side, lined with trees, and several cars parked along the road.",0.0,1.0,0.0,0.0,0.026784177869558334,0.8788670897483826,0.09434868395328522,0.5,0.26339208893477917
822774621669543,images/Westminster/822774621669543.jpg,Westminster,unknown,51.53742972271976,-0.1811315617454399,51.536561,-0.181112,236.4244,1447587413563,Mapillary,0.6,True,medium,low,light,none,fair,dim,1,1,0,2,1,1,1,3.9,6.1,1.7,3.6,3.2,8.0,"A street with cars parked along both sides, lined with trees and brick buildings under a cloudy sky.",0.0,1.0,0.0,0.0,0.028056591749191284,0.894912600517273,0.07703081518411636,0.5,0.26402829587459564
506910076985676,images/Westminster/506910076985676.jpg,Westminster,unknown,51.51803845446148,-0.1906193555054463,51.518924189779,-0.18975765444361,207.22967529297,1517915590156,Mapillary,0.4,True,low,medium,none,none,fair,normal,2,0,0,1,1,2,1,4.2,4.9,2.7,6.4,4.7,7.0,A train track with a graffiti-covered wall in the background and buildings visible behind it.,0.0,1.0,0.0,0.0,0.24556218087673187,0.7295528054237366,0.024885030463337898,0.5,0.37278109043836594
146402390836505,images/Westminster/146402390836505.jpg,Westminster,unknown,51.52744830679812,-0.1581273370555885,51.526244598577,-0.15723718157182,238.98678588867,1572272643919,Mapillary,0.6,True,high,low,none,low,fair,normal,1,0,1,3,1,2,1,2.4,8.1,4.3,3.6,5.3,5.7,"The image shows a paved path in a park with trees, grass, and a body of water on the right side.",0.0,1.0,0.0,0.0,0.005469989031553268,0.8148103952407837,0.17971967160701752,0.5,0.25273499451577663
169094608443783,images/Westminster/169094608443783.jpg,Westminster,unknown,51.51414767570037,-0.176123951266459,51.513260905348,-0.1753506154389,204.9249420166,1522487501656,Mapillary,0.4,True,low,medium,light,none,fair,normal,2,1,0,1,1,2,1,5.4,4.2,2.7,6.4,4.2,7.0,a large brick and white building with columns and balconies stands on a city street with cars parked along the sidewalk,0.0,1.0,0.0,0.0,0.024700835347175598,0.9124144315719604,0.06288470327854156,0.5,0.2623504176735878
151320743550658,images/Westminster/151320743550658.jpg,Westminster,unknown,51.49918491796876,-0.1783709028743132,51.498146,-0.17714000000001,330.5643,1491981350847,Mapillary,0.4,True,medium,medium,none,none,good,dim,2,0,0,2,2,1,1,3.4,6.5,2.3,6.4,4.8,7.0,A large building with many windows stands behind a lawn and some plants.,0.0,1.0,0.0,0.0,0.006888720206916332,0.6734395623207092,0.3196718096733093,0.5,0.25344436010345817
1375790916138972,images/Westminster/1375790916138972.jpg,Westminster,unknown,51.51214745184743,-0.1622494156732988,51.5127802,-0.16312149999999,-1.0,1514589370000,Mapillary,0.4,True,none,medium,moderate,low,fair,normal,2,2,1,0,1,2,1,6.9,2.2,4.3,6.4,4.3,5.7,"A sidewalk runs along the right side of the image, adjacent to a white building with a black metal fence and several windows, with cars parked on the left side of the street and people walking on the sidewalk in the background at nighttime.",0.0,1.0,0.0,0.0,0.05953533202409744,0.9102906584739685,0.030174007639288902,0.5,0.2797676660120487
1682028828841632,images/Westminster/1682028828841632.jpg,Westminster,unknown,51.53097976033065,-0.1667980948442726,51.531065455,-0.165362598,353.45019346082,1658663668399,Mapillary,0.6,True,medium,low,none,none,good,bright,1,0,0,2,2,3,1,2.3,7.1,4.3,3.6,6.8,5.0,"A tree-lined road with double yellow lines and a sidewalk on the left, adjacent to a brick wall and a hedge, with buildings and a blue sky in the background.",0.0,1.0,0.0,0.0,0.007943480275571346,0.8382329344749451,0.15382353961467743,0.5,0.2539717401377857
1364527301327671,images/Camden/1364527301327671.jpg,Camden,unknown,51.54658731612842,-0.1687341776192369,51.5468678,-0.1694944,285.096,1750097268000,Mapillary,0.4,True,low,medium,moderate,none,good,bright,2,2,0,1,2,3,1,6.1,3.9,4.3,6.4,5.8,5.0,A person rides a scooter down a street lined with white buildings and parked cars on both sides.,0.0,1.0,0.0,0.0,0.12440063059329987,0.8338086605072021,0.04179064556956291,0.5,0.31220031529664993
1765718690509430,images/Camden/1765718690509430.jpg,Camden,unknown,51.537843181423725,-0.1508661802547434,51.537548804707,-0.1511476235371,107.82479789801,1689941598351,Mapillary,0.6,True,medium,low,moderate,none,fair,normal,1,2,0,2,1,2,1,5.1,5.5,2.7,3.6,3.7,7.0,"The image shows a street scene with a black gate on the left, a beige house behind it, several cars driving on the road, and trees lining the sidewalk.",0.0,1.0,0.0,0.0,0.03310306370258331,0.9050753712654114,0.06182147189974785,0.5,0.26655153185129166
617898242985070,images/Camden/617898242985070.jpg,Camden,unknown,51.562926043410485,-0.1724211030099974,51.5634921,-0.1724205,317.76429572781,1658678514199,Mapillary,0.4,True,medium,medium,light,none,good,bright,2,1,0,2,2,3,1,4.6,5.9,4.3,6.4,6.3,5.0,"The image shows a street scene with a sidewalk, a road with parked cars, and buildings in the background.",0.0,1.0,0.0,0.0,0.13971397280693054,0.8240541219711304,0.03623192012310028,0.5,0.31985698640346527
1022273831795255,images/Camden/1022273831795255.jpg,Camden,unknown,51.55214238222442,-0.1595011473375032,51.5526082,-0.1584725,219.66080548944,1658678480599,Mapillary,0.4,True,medium,medium,light,none,fair,bright,2,1,0,2,1,3,1,5.1,5.5,3.7,6.4,5.2,6.0,"A sidewalk with a black metal fence and benches is on the left, a row of brownstone buildings with parked cars along the street is on the right.",0.0,1.0,0.0,0.0,0.17796136438846588,0.7955560684204102,0.026482582092285156,0.5,0.33898068219423294
1199530317535991,images/Camden/1199530317535991.jpg,Camden,unknown,51.5281757689294,-0.1394341743957956,51.5290971,-0.138902,185.42109129034,1658250756200,Mapillary,0.4,True,medium,medium,moderate,low,fair,normal,2,2,1,2,1,2,1,6.2,4.9,4.3,6.4,4.3,5.7,"A city street with a construction site on the left, several vehicles driving on the road, and buildings lining both sides of the street.",0.0,1.0,0.0,0.0,0.294790118932724,0.6775939464569092,0.027615932747721672,0.5,0.397395059466362
172436061426279,images/Camden/172436061426279.jpg,Camden,unknown,51.54224807741478,-0.1441011424052067,51.541541414167,-0.14438389777774,93.35632,1523805900000,Mapillary,0.4,True,low,medium,none,none,fair,dim,2,0,0,1,1,1,1,4.2,4.9,1.7,6.4,3.7,8.0,A canal runs between a building under construction with scaffolding and a white building with arched windows.,0.0,1.0,0.0,0.0,0.1614650934934616,0.8080947995185852,0.03044016659259796,0.5,0.3307325467467308
2595425250765513,images/Camden/2595425250765513.jpg,Camden,unknown,51.55610617367854,-0.1951949911883514,51.556783,-0.196169,15.29346,1431777445644,Mapillary,0.4,True,medium,medium,moderate,none,fair,normal,2,2,0,2,1,2,1,6.2,4.9,2.7,6.4,3.7,7.0,"A black Volkswagen Golf is stopped in a lane with a white van ahead, on a road lined with trees and buildings.",0.101,0.899,0.0,-0.2263,0.16787701845169067,0.7519374489784241,0.08018551021814346,0.61315,0.3905135092258453
199816415316565,images/Camden/199816415316565.jpg,Camden,unknown,51.56796552458581,-0.1606892083277681,51.566415841046,-0.16180284104608,309.13421630859,1561903660960,Mapillary,0.6,True,high,low,none,low,fair,bright,1,0,1,3,1,3,1,2.4,8.1,5.3,3.6,6.3,4.7,a dirt path runs through a grassy field with trees in the background,0.194,0.806,0.0,-0.34,0.0246310755610466,0.9022597074508667,0.07310926169157028,0.67,0.3473155377805233
1456608704807360,images/Camden/1456608704807360.jpg,Camden,unknown,51.55137029241968,-0.1548684400781594,51.5506751,-0.154722,288.28599981766,1658678276199,Mapillary,0.4,True,low,medium,light,low,fair,bright,2,1,1,1,1,3,1,5.4,4.2,5.3,6.4,5.8,4.7,"The image shows a street with buildings on either side, a sidewalk, and a road with a crosswalk and parked cars.",0.0,1.0,0.0,0.0,0.11156787723302841,0.8510813117027283,0.03735082969069481,0.5,0.3057839386165142
379333318149240,images/Camden/379333318149240.jpg,Camden,unknown,51.55876206986686,-0.1412328484472713,51.560053112599,-0.14121342458705,300.452750381,1708166487636,Mapillary,0.2,True,none,high,light,none,fair,dim,3,1,0,0,1,1,1,6.9,2.3,1.7,9.2,3.2,8.0,"The image shows a street with a large brick building on the right side featuring multiple white garage doors and windows, and a row of parked cars on the left side.",0.0,1.0,0.0,0.0,0.030035793781280518,0.9215900897979736,0.048374149948358536,0.5,0.26501789689064026
173936387966943,images/Camden/173936387966943.jpg,Camden,unknown,51.56347996208432,-0.1689005089272977,51.564727770213,-0.16818682663165,358.73571777344,1524316403171,Mapillary,0.6,True,high,low,none,medium,poor,normal,1,0,2,3,0,2,1,2.9,7.8,5.3,3.6,4.8,5.3,A dirt path with people walking on it surrounded by trees and greenery.,0.179,0.821,0.0,-0.34,0.007899871096014977,0.6192312240600586,0.3728688657283783,0.67,0.3389499355480075
1563397198114913,images/Camden/1563397198114913.jpg,Camden,unknown,51.55531324320781,-0.1884714669600788,51.553613572,-0.190009492,138.98997553946,1768655288662,Mapillary,0.4,True,none,medium,moderate,none,fair,normal,2,2,0,0,1,2,1,6.9,2.2,2.7,6.4,3.7,7.0,A white bus is on the left and a silver car is on the right on a road with brick buildings and a church steeple in the background.,0.0,1.0,0.0,0.0,0.024641672149300575,0.8922717571258545,0.08308659493923187,0.5,0.2623208360746503
1175849257674493,images/Camden/1175849257674493.jpg,Camden,unknown,51.54992400947801,-0.1731391292926547,51.5498451,-0.1740709,179.763,1750097584000,Mapillary,0.6,True,medium,low,moderate,none,good,bright,1,2,0,2,2,3,1,4.6,5.8,4.3,3.6,5.8,5.0,"A residential street with parked cars and scooters on the road, lined with brick houses and trees on a sunny day.",0.0,0.865,0.135,0.4215,0.08036164194345474,0.773691713809967,0.14594660699367523,0.28925,0.18480582097172737
2523298817854864,images/Camden/2523298817854864.jpg,Camden,unknown,51.54984462726304,-0.1413908375672234,51.54992907203,-0.14116786321355,260.30269323271,1718475497760,Mapillary,0.4,True,low,medium,none,none,fair,normal,2,0,0,1,1,2,1,4.2,4.9,2.7,6.4,4.7,7.0,"A narrow alleyway with a white garage door on the left, a scooter parked beside a hedge, and a large white building on the right.",0.0,1.0,0.0,0.0,0.031072696670889854,0.92164546251297,0.047281794250011444,0.5,0.2655363483354449
1179031812772262,images/Camden/1179031812772262.jpg,Camden,unknown,51.54208271030233,-0.1612420966173391,51.543784199998,-0.15924409999731,90.358825415373,1684940814104,Mapillary,0.6,True,medium,low,light,none,fair,bright,1,1,0,2,1,3,1,3.9,6.1,3.7,3.6,5.2,6.0,A white car is driving on a road with a sidewalk and trees on one side and a construction site with a crane on the other.,0.0,1.0,0.0,0.0,0.22156497836112976,0.7324079275131226,0.04602716863155365,0.5,0.3607824891805649
1579979148999854,images/Camden/1579979148999854.jpg,Camden,unknown,51.51910806209855,-0.1151080221546255,51.52008673,-0.11524632,32.628757476807,1398357209000,Mapillary,0.4,True,low,medium,light,low,fair,normal,2,1,1,1,1,2,1,5.4,4.2,4.3,6.4,4.8,5.7,A sidewalk runs along a row of brick buildings with a black metal fence on the left and a street with parked cars on the right.,0.0,1.0,0.0,0.0,0.10693822056055069,0.8686235547065735,0.02443818934261799,0.5,0.30346911028027534
499589774803672,images/Camden/499589774803672.jpg,Camden,unknown,51.54441141257541,-0.1927435932208369,51.5439693633,-0.1926420409,351.72967529297,1569263838810,Mapillary,0.4,True,none,medium,moderate,low,fair,bright,2,2,1,0,1,3,1,6.9,2.2,5.3,6.4,5.3,4.7,"A row of brick houses lines one side of a wet street at night, with a sidewalk and low brick wall separating them from the road, where several cars are driving away from the camera, their lights on.",0.058,0.942,0.0,-0.2732,0.1680939644575119,0.7862646579742432,0.04564133659005165,0.6366,0.402346982228756
1786985018411895,images/Camden/1786985018411895.jpg,Camden,unknown,51.528778912728576,-0.1253347114710676,51.528695547812,-0.12443556541373,355.32979274292,1707048497781,Mapillary,0.4,True,low,medium,light,low,good,normal,2,1,1,1,2,2,1,4.9,4.5,5.0,6.4,6.0,4.7,"A city street with buildings, bare trees, parked cars, a green metal fence, a brick wall, people walking and cycling, and a road marked with 'SCHOOL' in yellow paint.",0.0,1.0,0.0,0.0,0.2345261573791504,0.7089407444000244,0.05653311312198639,0.5,0.3672630786895752
1236621471522586,images/Camden/1236621471522586.jpg,Camden,unknown,51.56442554744476,-0.1427988622419435,51.565285908464,-0.14107691250073,172.03050063037,1751826120173,Mapillary,0.4,True,medium,medium,none,none,fair,bright,2,0,0,2,1,3,1,3.9,6.2,3.7,6.4,5.7,6.0,"A paved sidewalk with trash bins runs along the side of a road, lined with trees and bushes, in front of a multi-story building.",0.0,1.0,0.0,0.0,0.15287186205387115,0.7917059063911438,0.05542215332388878,0.5,0.3264359310269356
1188535788652318,images/Camden/1188535788652318.jpg,Camden,unknown,51.51829269278493,-0.1313510182201171,51.517540896154,-0.13061418461538,161.20099909891,1657029104729,Mapillary,0.2,True,low,high,moderate,medium,good,normal,3,2,2,1,2,2,1,7.2,3.3,6.7,9.2,6.2,3.3,"A man and woman walk on the sidewalk next to a busy street with a red double-decker bus, several buildings, and people walking in the background.",0.0,1.0,0.0,0.0,0.02844858542084694,0.890754759311676,0.08079662919044495,0.5,0.26422429271042347
3645555572234097,images/Camden/3645555572234097.jpg,Camden,unknown,51.545994710844845,-0.1724833714719448,51.545796,-0.172872,41.09454,1441537151560,Mapillary,0.4,True,medium,medium,moderate,none,good,bright,2,2,0,2,2,3,1,5.7,5.2,4.3,6.4,5.8,5.0,"A white van is parked on the left side of a tree-lined street with multiple cars parked along the right side, in front of large white buildings.",0.0,1.0,0.0,0.0,0.05324108526110649,0.8996859788894653,0.047072939574718475,0.5,0.27662054263055325
1934618100019821,images/Tower_Hamlets/1934618100019821.jpg,Tower Hamlets,unknown,51.515315581808586,-0.0642389892905985,51.51491628,-0.06513491,335.93538871403,1441614465431,Mapillary,0.2,True,low,high,light,none,fair,bright,3,1,0,1,1,3,1,6.5,3.6,3.7,9.2,5.2,6.0,"A multi-story building with a gray facade and numerous windows stands on a street corner, with a white van driving by and several trees and parked cars visible.",0.0,1.0,0.0,0.0,0.025367381051182747,0.9030405282974243,0.07159209996461868,0.5,0.2626836905255914
1040693161534998,images/Tower_Hamlets/1040693161534998.jpg,Tower Hamlets,unknown,51.532023610745625,-0.0409697545861823,51.532075486374,-0.04098650461653,102.93347941198,1751199125794,Mapillary,0.4,True,medium,medium,light,low,fair,bright,2,1,1,2,1,3,1,5.1,5.5,5.3,6.4,5.8,4.7,The scene shows a street with a multi-story brick building on the right and a gate with a sign that reads 'BOW WHARF' on the left.,0.0,1.0,0.0,0.0,0.030912868678569794,0.9254913330078125,0.04359576851129532,0.5,0.2654564343392849
1584112302308721,images/Tower_Hamlets/1584112302308721.jpg,Tower Hamlets,unknown,51.53634475738672,-0.0292745158098888,51.535823722332,-0.029268710388693,76.253012506224,1751198805141,Mapillary,0.4,True,medium,medium,moderate,none,fair,bright,2,2,0,2,1,3,1,6.2,4.9,3.7,6.4,4.7,6.0,"A street with a bus stop on the left side, lined with buildings and trees under a blue sky with clouds, with cars driving on the road.",0.087,0.913,0.0,-0.296,0.03312040865421295,0.8803865313529968,0.08649308234453201,0.648,0.3405602043271065
3960825717289971,images/Tower_Hamlets/3960825717289971.jpg,Tower Hamlets,unknown,51.516977517423655,-0.0709772445023602,51.515735,-0.07050678,248.59995095513,1441801264789,Mapillary,0.2,True,none,high,moderate,low,fair,normal,3,2,1,0,1,2,1,8.0,1.6,4.3,9.2,4.3,5.7,a city street with several vehicles and tall buildings on either side,0.0,1.0,0.0,0.0,0.02698948048055172,0.8597943782806396,0.11321613192558289,0.5,0.26349474024027586
1421638404840560,images/Tower_Hamlets/1421638404840560.jpg,Tower Hamlets,unknown,51.5301372879004,-0.0273972539120771,51.530942939928,-0.027091839928486,148.04760742188,1548163570439,Mapillary,0.4,True,medium,medium,light,none,fair,normal,2,1,0,2,1,2,1,5.1,5.5,2.7,6.4,4.2,7.0,"The image shows a street scene with parked cars on the right side of the road, a sidewalk on the left, and buildings and trees lining both sides.",0.0,1.0,0.0,0.0,0.08572454750537872,0.8654095530509949,0.04886587709188461,0.5,0.29286227375268936
1100694297520497,images/Tower_Hamlets/1100694297520497.jpg,Tower Hamlets,unknown,51.50935143348312,-0.0162579111381224,51.508987,-0.0165491,256.89785297152,1659019322700,Mapillary,0.4,True,medium,medium,light,none,good,normal,2,1,0,2,2,2,1,4.6,5.9,3.3,6.4,5.3,6.0,A tree-lined street with a black asphalt road featuring white pedestrian crossing markings and a sidewalk on the left with a black metal fence and a row of brown brick buildings on the right.,0.0,1.0,0.0,0.0,0.02912106178700924,0.9424924850463867,0.02838647924363613,0.5,0.2645605308935046
