image_id,filepath,borough,road_type,sample_latitude,sample_longitude,latitude,longitude,compass_angle,captured_at,source,sky_fraction,greenery_present,greenery_density,building_height_ratio,traffic_intensity,pedestrian_activity,surface_condition,lighting,height_enc,traffic_enc,pedestrian_enc,greenery_enc,surface_enc,light_enc,green_bin,stress,calm,vitality,enclosure,safety,desolation,scene_description,vader_neg,vader_neu,vader_pos,vader_compound,roberta_neg,roberta_neu,roberta_pos,vader_negativity,negativity_index
301148291687035,images/Waltham_Forest/301148291687035.jpg,Waltham Forest,unknown,51.57061665775553,-0.0464137918556361,51.570813888889,-0.0473,331.0,1437835532000,Mapillary,0.6,True,high,low,none,low,fair,bright,1,0,1,3,1,3,1,2.4,8.1,5.3,3.6,6.3,4.7,A person is running on the grassy edge of a gravel path that runs between areas of grass and bushes under a blue sky with white clouds.,0.061,0.939,0.0,-0.128,0.020157990977168083,0.8985166549682617,0.08132541924715042,0.5640000000000001,0.29207899548858407
148430621199761,images/Waltham_Forest/148430621199761.jpg,Waltham Forest,unknown,51.56321436631231,-0.042341744012814,51.563685983419,-0.042558778077364,58.50898521529,1659353429000,Mapillary,0.6,True,high,low,light,none,good,bright,1,1,0,3,2,3,1,3.1,7.8,4.3,3.6,6.3,5.0,a bike path with a grassy area and trees on either side,0.0,1.0,0.0,0.0,0.007422506809234619,0.815732479095459,0.17684493958950043,0.5,0.2537112534046173
704946925570756,images/Waltham_Forest/704946925570756.jpg,Waltham Forest,unknown,51.56258488264742,0.0051505038465634,51.5634328,0.0041397,256.0,1750087852000,Mapillary,0.6,True,low,low,moderate,none,fair,bright,1,2,0,1,1,3,1,5.4,4.1,3.7,3.6,4.7,6.0,"A multi-lane highway with several cars and vans driving on it, separated by a concrete barrier from a raised area with trees and streetlights, under a cloudy sky.",0.061,0.939,0.0,-0.128,0.03881533071398735,0.9015251994132996,0.059659443795681,0.5640000000000001,0.3014076653569937
1140570483333810,images/Waltham_Forest/1140570483333810.jpg,Waltham Forest,unknown,51.56559866399567,-0.0291281403085948,51.564017403871,-0.030897706747055,133.6819449813,1659353627000,Mapillary,0.6,True,medium,low,light,none,good,normal,1,1,0,2,2,2,1,3.4,6.5,3.3,3.6,5.3,6.0,A red car drives on a road with a blue pedestrian bridge overhead and trees on the left side.,0.0,1.0,0.0,0.0,0.02220066264271736,0.8702946901321411,0.10750459879636765,0.5,0.2611003313213587
536794557992287,images/Waltham_Forest/536794557992287.jpg,Waltham Forest,unknown,51.56591667073507,0.0089107251235855,51.565095819533,0.010068509727716,10.281772783395,1654701635000,Mapillary,0.4,True,medium,medium,moderate,low,good,bright,2,2,1,2,2,3,1,5.7,5.2,6.0,6.4,6.5,3.7,A street with a bike lane and several people walking on the sidewalk past shops and buildings.,0.0,1.0,0.0,0.0,0.01889992691576481,0.9025030732154846,0.07859694957733154,0.5,0.2594499634578824
453869369013639,images/Waltham_Forest/453869369013639.jpg,Waltham Forest,unknown,51.589614828490994,-0.0237650235251901,51.590130091645,-0.02429218031466,234.46158280434,1442269178738,Mapillary,0.6,True,none,low,light,none,fair,bright,1,1,0,0,1,3,1,4.6,3.5,3.7,3.6,5.2,6.0,"The image shows a dark road with streetlights, a brick wall, and trees in the background.",0.0,1.0,0.0,0.0,0.09844950586557388,0.863056480884552,0.03849397227168083,0.5,0.29922475293278694
505098243857471,images/Waltham_Forest/505098243857471.jpg,Waltham Forest,unknown,51.57744977126728,-0.0231908817404872,51.58006,-0.022346,254.4196,1448707715169,Mapillary,0.4,True,low,medium,light,none,fair,dim,2,1,0,1,1,1,1,5.4,4.2,1.7,6.4,3.2,8.0,"The image shows a residential street with rows of two-story houses on either side, several cars parked along the road, and a cloudy sky above.",0.0,1.0,0.0,0.0,0.020869143307209015,0.8953519463539124,0.08377889543771744,0.5,0.2604345716536045
1020342326937692,images/Waltham_Forest/1020342326937692.jpg,Waltham Forest,unknown,51.59329237429507,0.0035868798083104,51.597219493333,0.0068228,123.90097552353,1751321096766,Mapillary,0.6,True,medium,low,moderate,none,good,bright,1,2,0,2,2,3,1,4.6,5.8,4.3,3.6,5.8,5.0,A multi-lane road with streetlights and trees on both sides at night.,0.0,1.0,0.0,0.0,0.051086101680994034,0.8777264356613159,0.07118746638298035,0.5,0.275543050840497
1689318225296743,images/Waltham_Forest/1689318225296743.jpg,Waltham Forest,unknown,51.57982036172903,-0.0152885573034355,51.577908026891,-0.016735471465872,149.97441433372,1740227880078,Mapillary,0.4,True,low,medium,moderate,low,good,normal,2,2,1,1,2,2,1,6.1,3.9,5.0,6.4,5.5,4.7,"The image shows a street with a white car driving on it, surrounded by buildings, bare trees, and people walking on the sidewalks.",0.0,1.0,0.0,0.0,0.18855611979961395,0.7806720733642578,0.030771778896450996,0.5,0.344278059899807
716991901117451,images/Waltham_Forest/716991901117451.jpg,Waltham Forest,unknown,51.59523286501962,0.0088737839220243,51.5961426,0.00943085,118.46404524762,1751321108500,Mapillary,0.6,True,low,low,moderate,none,good,bright,1,2,0,1,2,3,1,4.9,4.5,4.3,3.6,5.8,5.0,The image shows a nighttime highway scene with several cars driving on a multi-lane road with streetlights and signs.,0.0,1.0,0.0,0.0,0.06380503624677658,0.8902276754379272,0.045967377722263336,0.5,0.2819025181233883
1042235297747527,images/Waltham_Forest/1042235297747527.jpg,Waltham Forest,unknown,51.58545927070229,0.0112045166622869,51.588725445825,0.007468635496214,15.611310478335,1740228573037,Mapillary,0.6,True,medium,low,light,none,good,normal,1,1,0,2,2,2,1,3.4,6.5,3.3,3.6,5.3,6.0,"A road with a bike lane on the left and a grassy verge on the right, lined with leafless trees on both sides, with cars driving on it.",0.0,1.0,0.0,0.0,0.08334988355636597,0.8482568860054016,0.06839325278997421,0.5,0.291674941778183
1413293805673186,images/Waltham_Forest/1413293805673186.jpg,Waltham Forest,unknown,51.5771448785102,-0.0216527578848692,51.580316,-0.021299,254.1825,1448707701141,Mapillary,0.6,True,none,low,light,none,fair,normal,1,1,0,0,1,2,1,4.6,3.5,2.7,3.6,4.2,7.0,"A residential street with parked cars on both sides, traffic cones in the middle of the road, and a cloudy sky above.",0.0,1.0,0.0,0.0,0.2180050164461136,0.7332507371902466,0.048744283616542816,0.5,0.3590025082230568
1464070605412240,images/Waltham_Forest/1464070605412240.jpg,Waltham Forest,unknown,51.60087864444233,-0.0286747818710956,51.5996051,-0.0271653,109.0,1774339426830,Mapillary,0.4,True,low,medium,moderate,low,fair,dim,2,2,1,1,1,1,1,6.6,3.5,3.3,6.4,3.3,6.7,"The image shows a street scene with a multi-story brick building on the left, a sidewalk with a pedestrian, and a road with several vehicles traveling in the same direction under a cloudy sky.",0.0,1.0,0.0,0.0,0.01906372234225273,0.9316986799240112,0.04923762381076813,0.5,0.25953186117112637
542135214933408,images/Waltham_Forest/542135214933408.jpg,Waltham Forest,unknown,51.5632948526546,0.0082257909541509,51.562483,0.009293,198.461,1726741285000,Mapillary,0.4,True,low,medium,moderate,low,fair,bright,2,2,1,1,1,3,1,6.6,3.5,5.3,6.4,5.3,4.7,"The image shows a street scene with a row of multi-story buildings on the left and right sides, a road with double yellow lines down the center, and a blue sky with white clouds in the background.",0.0,1.0,0.0,0.0,0.010900820605456829,0.8944621086120605,0.09463706612586975,0.5,0.2554504103027284
1020603889505351,images/Redbridge/1020603889505351.jpg,Redbridge,unknown,51.59835994293013,0.0438805538489654,51.59873264,0.043668033333333,46.546165913755,1724058440133,Mapillary,0.6,True,high,low,moderate,none,good,normal,1,2,0,3,2,2,1,4.3,7.1,3.3,3.6,4.8,6.0,"The image shows a road with a black SUV in the left lane, a large truck in the middle lane, and other vehicles in the distance, with trees and a guardrail on the right side.",0.0,1.0,0.0,0.0,0.05665229260921478,0.8958964347839355,0.04745130240917206,0.5,0.2783261463046074
1151955046676178,images/Redbridge/1151955046676178.jpg,Redbridge,unknown,51.61585342554775,0.0231237648147087,51.615063859266,0.025042803804019,13.335164006606,1740229276035,Mapillary,0.6,True,low,low,light,low,good,normal,1,1,1,1,2,2,1,3.8,5.1,5.0,3.6,6.0,4.7,A two-lane road with a green metal fence on the right side and houses and cars on both sides of the road.,0.0,1.0,0.0,0.0,0.07484176009893417,0.87933748960495,0.045820802450180054,0.5,0.2874208800494671
146447280777449,images/Redbridge/146447280777449.jpg,Redbridge,unknown,51.56792854813047,0.1285282413323022,51.567824,0.127769,87.18378,1462442605780,Mapillary,0.6,True,low,low,none,none,fair,bright,1,0,0,1,1,3,1,3.1,5.5,3.7,3.6,5.7,6.0,"A sign reading 'Chadwell Heath' is on a pole next to a road, with a gray fence and houses in the background.",0.0,1.0,0.0,0.0,0.042974311858415604,0.9146431684494019,0.04238244891166687,0.5,0.2714871559292078
1865807433974765,images/Redbridge/1865807433974765.jpg,Redbridge,unknown,51.566879885996165,0.1161303314509352,51.5677786,0.1162725,16.0,1750085153000,Mapillary,0.4,True,medium,medium,moderate,none,good,bright,2,2,0,2,2,3,1,5.7,5.2,4.3,6.4,5.8,5.0,A black BMW SUV is driving on a road with a red double-decker bus on the left and trees and buildings in the background.,0.0,1.0,0.0,0.0,0.02459115721285343,0.8431983590126038,0.13221044838428497,0.5,0.2622955786064267
1036418881352181,images/Redbridge/1036418881352181.jpg,Redbridge,unknown,51.58211939756634,0.0399428688115299,51.58244625,0.039778883333333,348.01849300453,1724058347166,Mapillary,0.6,True,medium,low,moderate,none,good,normal,1,2,0,2,2,2,1,4.6,5.8,3.3,3.6,4.8,6.0,A motorcyclist is riding on the left side of a multi-lane road with a metal guardrail and green trees on the left and other vehicles driving in the distance.,0.0,1.0,0.0,0.0,0.1293671578168869,0.8225547075271606,0.048078082501888275,0.5,0.31468357890844345
548985203443456,images/Redbridge/548985203443456.jpg,Redbridge,unknown,51.58646720173015,0.016177375322657,51.583346156403,0.020251097157598,4.4308498866309,1654702209000,Mapillary,0.6,True,high,low,moderate,none,good,bright,1,2,0,3,2,3,1,4.3,7.1,4.3,3.6,5.8,5.0,"A road with two lanes and a sidewalk on the left, lined with trees and grass, with cars driving on it.",0.0,1.0,0.0,0.0,0.11877655982971191,0.829501211643219,0.05172215402126312,0.5,0.30938827991485596
1319321915705529,images/Redbridge/1319321915705529.jpg,Redbridge,unknown,51.6111952099324,0.100197200688812,51.614959292965,0.096842438190955,69.338354295531,1759694194592,Mapillary,0.6,True,low,low,light,none,good,dim,1,1,0,1,2,1,1,3.8,5.1,2.3,3.6,4.3,7.0,A vehicle is driving on a road at night with streetlights and other cars visible.,0.0,1.0,0.0,0.0,0.11513600498437881,0.8362547755241394,0.0486091785132885,0.5,0.3075680024921894
183900077913771,images/Redbridge/183900077913771.jpg,Redbridge,unknown,51.56808376461181,0.0280533831605322,51.5640967,0.0253143,280.436,1682787791000,Mapillary,0.6,True,medium,low,moderate,none,good,bright,1,2,0,2,2,3,1,4.6,5.8,4.3,3.6,5.8,5.0,"A curved road with double yellow lines and parked cars on both sides, lined with trees and buildings under a clear blue sky.",0.0,0.885,0.115,0.3818,0.016240939497947693,0.6067245602607727,0.3770344853401184,0.30910000000000004,0.16267046974897387
1298649908133410,images/Redbridge/1298649908133410.jpg,Redbridge,unknown,51.60305074312292,0.1255143516699444,51.60997325,0.127312965,145.22373462834,1759694414124,Mapillary,0.6,True,low,low,light,none,good,bright,1,1,0,1,2,3,1,3.8,5.1,4.3,3.6,6.3,5.0,"A car drives on a road at night with another car ahead, streetlights, and a brick wall to the left.",0.0,1.0,0.0,0.0,0.13465581834316254,0.8271041512489319,0.03824002668261528,0.5,0.31732790917158127
1485078915280356,images/Redbridge/1485078915280356.jpg,Redbridge,unknown,51.6038594919138,0.0282213800761933,51.604407280684,0.029089143499732,112.51658257891,1654702789000,Mapillary,0.6,True,medium,low,moderate,none,good,bright,1,2,0,2,2,3,1,4.6,5.8,4.3,3.6,5.8,5.0,"The image shows a suburban street with two rows of houses on either side, several cars driving on the road, and trees and bushes lining the sidewalk.",0.0,1.0,0.0,0.0,0.041905228048563004,0.9010567665100098,0.05703800171613693,0.5,0.2709526140242815
1232514590989608,images/Redbridge/1232514590989608.jpg,Redbridge,unknown,51.54401762218135,0.0718444974416677,51.5443679,0.0731574,175.64,1678030765000,Mapillary,0.6,True,none,low,light,none,fair,dim,1,1,0,0,1,1,1,4.6,3.5,1.7,3.6,3.2,8.0,"The image shows a suburban street with houses on both sides, a sidewalk on the left, and a cloudy sky above.",0.0,1.0,0.0,0.0,0.011431317776441574,0.8873493671417236,0.10121925920248032,0.5,0.2557156588882208
146742994598984,images/Redbridge/146742994598984.jpg,Redbridge,unknown,51.56543850847056,0.0198339652715158,51.561532001942,0.021233204752207,58.464491928444,1654179276000,Mapillary,0.6,True,medium,low,light,none,good,bright,1,1,0,2,2,3,1,3.4,6.5,4.3,3.6,6.3,5.0,"A road with a blue car driving on it, with a grassy hill and house to the left and trees and streetlights along the road.",0.0,1.0,0.0,0.0,0.029717788100242615,0.8793103098869324,0.09097195416688919,0.5,0.2648588940501213
294843682268377,images/Redbridge/294843682268377.jpg,Redbridge,unknown,51.59046618485027,0.126246759405494,51.584246,0.12786800000003,274.2621,1494331220860,Mapillary,0.6,True,low,low,none,none,fair,normal,1,0,0,1,1,2,1,3.1,5.5,2.7,3.6,4.7,7.0,The image shows a view from inside a car parked on a residential street with a red brick house with a silver car parked on the left and a brown front door on the right.,0.0,1.0,0.0,0.0,0.014823982492089272,0.9375057220458984,0.04767024144530296,0.5,0.25741199124604464
1048585860586204,images/Redbridge/1048585860586204.jpg,Redbridge,unknown,51.58866886161464,0.1110779031499541,51.58243326,0.11837098,99.220012141394,1751439746800,Mapillary,0.6,True,medium,low,moderate,low,fair,normal,1,2,1,2,1,2,1,5.1,5.5,4.3,3.6,4.3,5.7,"The road has multiple lanes with cars driving on it, and there are trees and streetlights along the sides.",0.0,1.0,0.0,0.0,0.13598640263080597,0.7968706488609314,0.06714294850826263,0.5,0.317993201315403
188654170731370,images/Redbridge/188654170731370.jpg,Redbridge,unknown,51.5681882043502,0.0243342971509769,51.5640434,0.0254098,311.918,1682787789000,Mapillary,0.6,True,medium,low,light,none,fair,bright,1,1,0,2,1,3,1,3.9,6.1,3.7,3.6,5.2,6.0,"A road with cars driving on it, lined with trees and a brick wall on one side, and a sidewalk with a metal railing on the other.",0.0,1.0,0.0,0.0,0.1294136345386505,0.8386144042015076,0.031971924006938934,0.5,0.31470681726932526
1101614850805154,images/Redbridge/1101614850805154.jpg,Redbridge,unknown,51.55304209423419,0.0730430632003339,51.5537853,0.0731409,65.991,1694254149000,Mapillary,0.6,True,none,low,light,none,fair,bright,1,1,0,0,1,3,1,4.6,3.5,3.7,3.6,5.2,6.0,A white truck is parked on the left side of a street with a row of houses on the right and a clear blue sky above.,0.0,0.89,0.11,0.3818,0.008214705623686314,0.6574519872665405,0.33433330059051514,0.30910000000000004,0.15865735281184318
1263478215780529,images/Redbridge/1263478215780529.jpg,Redbridge,unknown,51.59456238567487,0.1361290988569629,51.5938467,0.1432356,41.0,1750082195000,Mapillary,0.6,True,medium,low,none,none,good,bright,1,0,0,2,2,3,1,2.3,7.1,4.3,3.6,6.8,5.0,"The scene shows a straight road with trees on both sides, a bike lane, and advertisements on the right-hand side.",0.0,0.899,0.101,0.2263,0.06357038766145706,0.866769552230835,0.0696600079536438,0.38685,0.22521019383072854
513972680520477,images/Redbridge/513972680520477.jpg,Redbridge,unknown,51.55583804574852,0.0427449378557572,51.554934438318,0.043628476560116,98.149716134203,1656139371000,Mapillary,0.6,True,medium,low,moderate,none,fair,bright,1,2,0,2,1,3,1,5.1,5.5,3.7,3.6,4.7,6.0,"The image shows a road with cars driving on it, lined with trees and a brick wall on one side and bushes on the other.",0.0,1.0,0.0,0.0,0.17800892889499664,0.7893369197845459,0.03265412151813507,0.5,0.3390044644474983
1236038903505826,images/Redbridge/1236038903505826.jpg,Redbridge,unknown,51.57916608752229,0.042551484302832,51.579518,0.042023,163.9261,1462709350364,Mapillary,0.6,True,low,low,moderate,none,good,bright,1,2,0,1,2,3,1,4.9,4.5,4.3,3.6,5.8,5.0,"A highway with multiple lanes and several cars driving on it, with a sign indicating a low emission zone and a power line structure in the background.",0.087,0.913,0.0,-0.2732,0.04029303044080734,0.8786475658416748,0.08105941116809845,0.6366,0.3384465152204037
1263333094526452,images/Redbridge/1263333094526452.jpg,Redbridge,unknown,51.55088490875002,0.1022263105540793,51.5492885,0.102719,242.137,1674126691000,Mapillary,0.4,True,low,medium,light,none,fair,bright,2,1,0,1,1,3,1,5.4,4.2,3.7,6.4,5.2,6.0,"A sidewalk runs along a residential street with bare trees, grassy areas, and parked cars in front of brick buildings.",0.0,1.0,0.0,0.0,0.08996646106243134,0.8642584085464478,0.04577520117163658,0.5,0.29498323053121567
179639164023399,images/Sutton/179639164023399.jpg,Sutton,unknown,51.35799147784534,-0.1778252355648344,51.361404,-0.179462,121.9763,1461770650362,Mapillary,0.6,True,high,low,none,none,fair,normal,1,0,0,3,1,2,1,2.4,8.1,2.7,3.6,4.7,7.0,A train track runs along a dirt path beside a dense thicket of green bushes and trees under a blue sky with white clouds.,0.112,0.888,0.0,-0.34,0.012100283987820148,0.8486692309379578,0.13923053443431854,0.67,0.3410501419939101
1155034878292501,images/Sutton/1155034878292501.jpg,Sutton,unknown,51.35531703311948,-0.1952519385090229,51.3552415,-0.19556404404883,90.0,1603885549757,Mapillary,0.4,True,medium,medium,light,low,fair,normal,2,1,1,2,1,2,1,5.1,5.5,4.3,6.4,4.8,5.7,"A woman walks on a sidewalk next to a road with a white car parked on it, in front of a red brick building with a sign that reads 'Redruth House PRIVATE PROPERTY STRICTLY RESIDENTS PARKING ONLY'.",0.0,1.0,0.0,0.0,0.16187581419944763,0.791614830493927,0.04650939255952835,0.5,0.3309379070997238
215218590115556,images/Enfield/215218590115556.jpg,Enfield,unknown,51.64553861431534,-0.0961691691610773,51.640681299972,-0.096062599999982,-1.0,1514552367000,Mapillary,0.6,True,none,low,none,none,fair,bright,1,0,0,0,1,3,1,3.4,4.1,3.7,3.6,5.7,6.0,"The view is of an airplane wing and engine from inside the plane, with clouds and blue sky visible through the window.",0.0,1.0,0.0,0.0,0.009596333838999271,0.7183717489242554,0.27203190326690674,0.5,0.25479816691949964
152212397278509,images/Sutton/152212397278509.jpg,Sutton,unknown,51.34630462460548,-0.144096402822665,51.354056699997,-0.137847,0.0,1649934233584,Mapillary,0.4,True,medium,medium,none,none,good,normal,2,0,0,2,2,2,1,3.4,6.5,3.3,6.4,5.8,6.0,A large house with a garden and a tree in bloom is visible.,0.0,1.0,0.0,0.0,0.0015591401606798172,0.23671486973762512,0.7617259621620178,0.5,0.2507795700803399
362277328552159,images/Sutton/362277328552159.jpg,Sutton,unknown,51.36668725273576,-0.1512388646931211,51.373569,-0.156835,137.6901,1458750337364,Mapillary,0.6,True,medium,low,none,none,poor,dim,1,0,0,2,0,1,1,3.3,6.5,1.0,3.6,2.5,9.0,houses are visible through trees,0.0,1.0,0.0,0.0,0.019592037424445152,0.7498292326927185,0.23057879507541656,0.5,0.2597960187122226
127600859361663,images/Sutton/127600859361663.jpg,Sutton,unknown,51.37437637080308,-0.1462834701339392,51.376748,-0.154223,295.4907,1458835456249,Mapillary,0.6,True,high,low,none,none,poor,dim,1,0,0,3,0,1,1,2.9,7.8,1.0,3.6,2.5,9.0,A blurry view of trees and a wall is visible through a window.,0.135,0.865,0.0,-0.1027,0.056522101163864136,0.8684253692626953,0.07505246996879578,0.55135,0.30393605058193207
104675302206215,images/Sutton/104675302206215.jpg,Sutton,unknown,51.38000833622432,-0.175260906603456,51.3759488,-0.18200980392157,0.0,1649343103510,Mapillary,0.6,True,medium,low,light,none,good,normal,1,1,0,2,2,2,1,3.4,6.5,3.3,3.6,5.3,6.0,A tree stands on the sidewalk of a residential street with houses and a black car parked on the road.,0.0,1.0,0.0,0.0,0.09015793353319168,0.8736094832420349,0.036232542246580124,0.5,0.29507896676659584
543197990499274,images/Sutton/543197990499274.jpg,Sutton,unknown,51.37151459765697,-0.1857204518344701,51.3724232,-0.18431419999819,0.0,1649342726414,Mapillary,0.6,True,low,low,light,none,fair,normal,1,1,0,1,1,2,1,4.3,4.8,2.7,3.6,4.2,7.0,A sidewalk runs along a residential street lined with parked cars and houses.,0.0,1.0,0.0,0.0,0.1489589363336563,0.8190458416938782,0.03199527785181999,0.5,0.32447946816682816
757737608234829,images/Sutton/757737608234829.jpg,Sutton,unknown,51.379863716138665,-0.1642447511150656,51.379288388889,-0.16233088888889,0.0,1542897125228,Mapillary,0.6,True,none,low,none,none,fair,dim,1,0,0,0,1,1,1,3.4,4.1,1.7,3.6,3.7,8.0,a red postbox with a white label displaying collection times is on a paved surface,0.0,1.0,0.0,0.0,0.023464273661375046,0.9060952663421631,0.0704403966665268,0.5,0.2617321368306875
1020187938720660,images/Sutton/1020187938720660.jpg,Sutton,unknown,51.34261143820687,-0.1866127388384449,51.343030666667,-0.18393255555556,0.0,1542451069375,Mapillary,0.6,True,low,low,none,none,fair,dim,1,0,0,1,1,1,1,3.1,5.5,1.7,3.6,3.7,8.0,A red postbox with a white label on it is on the side of a road with a double yellow line.,0.0,1.0,0.0,0.0,0.11102951318025589,0.8319684267044067,0.05700206756591797,0.5,0.30551475659012794
318093963168581,images/Sutton/318093963168581.jpg,Sutton,unknown,51.33972585827076,-0.1756442583260676,51.34542546,-0.17027501,274.15569776297,1434715616927,Mapillary,0.6,True,none,low,none,none,fair,dim,1,0,0,0,1,1,1,3.4,4.1,1.7,3.6,3.7,8.0,A yellow tactile paving strip with raised bumps is adjacent to a dark gray asphalt road.,0.0,1.0,0.0,0.0,0.04004558548331261,0.9251274466514587,0.034826964139938354,0.5,0.2700227927416563
313154073818344,images/Sutton/313154073818344.jpg,Sutton,unknown,51.335252441018206,-0.1486236974619081,51.328330583333,-0.14993522222222,0.0,1527687976905,Mapillary,0.6,True,high,low,none,none,fair,normal,1,0,0,3,1,2,1,2.4,8.1,2.7,3.6,4.7,7.0,a red post box with a white schedule on the front,0.0,1.0,0.0,0.0,0.042365726083517075,0.8812909126281738,0.07634337246417999,0.5,0.27118286304175854
396829551958404,images/Sutton/396829551958404.jpg,Sutton,unknown,51.34537860799544,-0.134165366234684,51.352769700001,-0.1372935,0.0,1649934276501,Mapillary,0.6,True,medium,low,light,none,good,normal,1,1,0,2,2,2,1,3.4,6.5,3.3,3.6,5.3,6.0,"A suburban street with houses, trees, and a grassy area with a bench.",0.0,1.0,0.0,0.0,0.020101258531212807,0.8780117630958557,0.10188699513673782,0.5,0.2600506292656064
363450648409739,images/Sutton/363450648409739.jpg,Sutton,unknown,51.374960315133634,-0.1311211882852744,51.37031167,-0.12416727,260.81170654297,1406913422000,Mapillary,0.6,True,high,low,none,low,fair,normal,1,0,1,3,1,2,1,2.4,8.1,4.3,3.6,5.3,5.7,"A paved path runs through a green area with trees and grass, with a road to the left and a signpost on the right.",0.0,1.0,0.0,0.0,0.008423903025686741,0.8829842209815979,0.10859186947345734,0.5,0.25421195151284337
1316972358794566,images/Sutton/1316972358794566.jpg,Sutton,unknown,51.34931341658361,-0.1304592356237502,51.35305,-0.13397619999758,0.0,1649934310511,Mapillary,0.6,True,medium,low,light,none,good,normal,1,1,0,2,2,2,1,3.4,6.5,3.3,3.6,5.3,6.0,"There is a road with cars parked on the left side, a sidewalk, a grassy area with trees and flowers, and a bench on the right side.",0.0,1.0,0.0,0.0,0.01802946999669075,0.8737887740135193,0.10818178206682205,0.5,0.2590147349983454
1419012771986284,images/Sutton/1419012771986284.jpg,Sutton,unknown,51.38797585155879,-0.1814924064067818,51.391656,-0.189306,0.0,1696163162000,Mapillary,0.6,True,medium,low,none,none,good,bright,1,0,0,2,2,3,1,2.3,7.1,4.3,3.6,6.8,5.0,a person wearing a helmet is on a road with houses and cars in the background,0.0,1.0,0.0,0.0,0.1734374761581421,0.7642590999603271,0.06230342388153076,0.5,0.33671873807907104
337998114612825,images/Sutton/337998114612825.jpg,Sutton,unknown,51.38064345695521,-0.1680078542412153,51.375467416667,-0.16073372222222,0.0,1542889834379,Mapillary,0.6,True,none,low,none,none,fair,normal,1,0,0,0,1,2,1,3.4,4.1,2.7,3.6,4.7,7.0,a red postbox with a white sign on it,0.0,1.0,0.0,0.0,0.048725612461566925,0.8467819094657898,0.10449248552322388,0.5,0.27436280623078346
755635705133336,images/Sutton/755635705133336.jpg,Sutton,unknown,51.34460823962621,-0.1753302182482355,51.34659407,-0.16876195,85.426555991173,1434714739680,Mapillary,0.6,True,none,low,none,none,good,normal,1,0,0,0,2,2,1,2.9,4.5,3.3,3.6,5.8,6.0,"The lower part of a person's legs are visible, standing next to a wheel.",0.167,0.833,0.0,-0.296,0.052367545664310455,0.8995835185050964,0.048048898577690125,0.648,0.35018377283215524
1013794687253153,images/Richmond_upon_Thames/1013794687253153.jpg,Richmond upon Thames,unknown,51.45022602366309,-0.340813132236515,51.4538411,-0.3380494,305.0,1750096427000,Mapillary,0.4,True,medium,medium,moderate,none,good,bright,2,2,0,2,2,3,1,5.7,5.2,4.3,6.4,5.8,5.0,"A road with cars driving on it, lined with trees and a fence, and a sign that reads 'Red Route Clearway' and 'No stopping'.",0.099,0.901,0.0,-0.296,0.08366373181343079,0.8444552421569824,0.071881003677845,0.648,0.3658318659067154
2010307126168462,images/Richmond_upon_Thames/2010307126168462.jpg,Richmond upon Thames,unknown,51.458728101754176,-0.320482050456182,51.4578158,-0.3196781,298.0,1750095789000,Mapillary,0.6,True,high,low,light,none,good,bright,1,1,0,3,2,3,1,3.1,7.8,4.3,3.6,6.3,5.0,a road with two cars and trees on the side,0.0,1.0,0.0,0.0,0.1204468235373497,0.8148794770240784,0.06467367708683014,0.5,0.31022341176867485
